{
  "$schema": "https://json-schema.org/draft/2020-12/schema",
  "$id": "https://github.com/ttab/revisor/constraint-set",
  "$ref": "#/$defs/ConstraintSet",
  "$defs": {
    "BlockConstraint": {
      "properties": {
        "ref": {
          "type": "string"
        },
        "declares": {
          "$ref": "#/$defs/BlockSignature"
        },
        "name": {
          "type": "string"
        },
        "description": {
          "type": "string"
        },
        "match": {
          "additionalProperties": {
            "$ref": "#/$defs/StringConstraint"
          },
          "type": "object"
        },
        "count": {
          "type": "integer"
        },
        "maxCount": {
          "type": "integer"
        },
        "minCount": {
          "type": "integer"
        },
        "links": {
          "items": {
            "$ref": "#/$defs/BlockConstraint"
          },
          "type": "array"
        },
        "meta": {
          "items": {
            "$ref": "#/$defs/BlockConstraint"
          },
          "type": "array"
        },
        "content": {
          "items": {
            "$ref": "#/$defs/BlockConstraint"
          },
          "type": "array"
        },
        "attributes": {
          "additionalProperties": {
            "$ref": "#/$defs/StringConstraint"
          },
          "type": "object"
        },
        "data": {
          "additionalProperties": {
            "$ref": "#/$defs/StringConstraint"
          },
          "type": "object"
        },
        "deprecated": {
          "$ref": "#/$defs/Deprecation"
        }
      },
      "additionalProperties": false,
      "type": "object"
    },
    "BlockDefinition": {
      "properties": {
        "id": {
          "type": "string"
        },
        "block": {
          "$ref": "#/$defs/BlockConstraint"
        }
      },
      "additionalProperties": false,
      "type": "object",
      "required": [
        "id",
        "block"
      ]
    },
    "BlockSignature": {
      "properties": {
        "type": {
          "type": "string"
        },
        "rel": {
          "type": "string"
        },
        "role": {
          "type": "string"
        }
      },
      "additionalProperties": false,
      "type": "object"
    },
    "ConstraintSet": {
      "properties": {
        "version": {
          "type": "integer"
        },
        "$schema": {
          "type": "string"
        },
        "name": {
          "type": "string"
        },
        "documents": {
          "items": {
            "$ref": "#/$defs/DocumentConstraint"
          },
          "type": "array"
        },
        "links": {
          "items": {
            "$ref": "#/$defs/BlockDefinition"
          },
          "type": "array"
        },
        "meta": {
          "items": {
            "$ref": "#/$defs/BlockDefinition"
          },
          "type": "array"
        },
        "content": {
          "items": {
            "$ref": "#/$defs/BlockDefinition"
          },
          "type": "array"
        },
        "enums": {
          "items": {
            "$ref": "#/$defs/Enum"
          },
          "type": "array"
        },
        "htmlPolicies": {
          "items": {
            "$ref": "#/$defs/HTMLPolicy"
          },
          "type": "array"
        }
      },
      "additionalProperties": false,
      "type": "object",
      "required": [
        "name"
      ]
    },
    "Deprecation": {
      "properties": {
        "label": {
          "type": "string"
        },
        "doc": {
          "type": "string"
        }
      },
      "additionalProperties": false,
      "type": "object",
      "required": [
        "label",
        "doc"
      ]
    },
    "DocumentConstraint": {
      "properties": {
        "name": {
          "type": "string"
        },
        "description": {
          "type": "string"
        },
        "declares": {
          "type": "string"
        },
        "match": {
          "additionalProperties": {
            "$ref": "#/$defs/StringConstraint"
          },
          "type": "object"
        },
        "links": {
          "items": {
            "$ref": "#/$defs/BlockConstraint"
          },
          "type": "array"
        },
        "meta": {
          "items": {
            "$ref": "#/$defs/BlockConstraint"
          },
          "type": "array"
        },
        "content": {
          "items": {
            "$ref": "#/$defs/BlockConstraint"
          },
          "type": "array"
        },
        "attributes": {
          "additionalProperties": {
            "$ref": "#/$defs/StringConstraint"
          },
          "type": "object"
        },
        "deprecated": {
          "$ref": "#/$defs/Deprecation"
        }
      },
      "additionalProperties": false,
      "type": "object"
    },
    "Enum": {
      "properties": {
        "declare": {
          "type": "string"
        },
        "match": {
          "type": "string"
        },
        "name": {
          "type": "string"
        },
        "description": {
          "type": "string"
        },
        "values": {
          "additionalProperties": {
            "$ref": "#/$defs/EnumConstraint"
          },
          "type": "object"
        }
      },
      "additionalProperties": false,
      "type": "object",
      "required": [
        "values"
      ]
    },
    "EnumConstraint": {
      "properties": {
        "forbidden": {
          "type": "boolean"
        },
        "deprecated": {
          "$ref": "#/$defs/Deprecation"
        },
        "description": {
          "type": "string"
        }
      },
      "additionalProperties": false,
      "type": "object"
    },
    "Glob": {
      "properties": {},
      "additionalProperties": false,
      "type": "object"
    },
    "GlobList": {
      "items": {
        "$ref": "#/$defs/Glob"
      },
      "type": "array"
    },
    "HTMLElement": {
      "properties": {
        "attributes": {
          "additionalProperties": {
            "$ref": "#/$defs/StringConstraint"
          },
          "type": "object"
        }
      },
      "additionalProperties": false,
      "type": "object"
    },
    "HTMLPolicy": {
      "properties": {
        "name": {
          "type": "string"
        },
        "description": {
          "type": "string"
        },
        "uses": {
          "type": "string"
        },
        "extends": {
          "type": "string"
        },
        "elements": {
          "additionalProperties": {
            "$ref": "#/$defs/HTMLElement"
          },
          "type": "object"
        }
      },
      "additionalProperties": false,
      "type": "object",
      "required": [
        "elements"
      ]
    },
    "Regexp": {
      "properties": {},
      "additionalProperties": false,
      "type": "object"
    },
    "StringConstraint": {
      "properties": {
        "name": {
          "type": "string"
        },
        "description": {
          "type": "string"
        },
        "optional": {
          "type": "boolean"
        },
        "allowEmpty": {
          "type": "boolean"
        },
        "const": {
          "type": "string"
        },
        "enum": {
          "items": {
            "type": "string"
          },
          "type": "array"
        },
        "enumReference": {
          "type": "string"
        },
        "pattern": {
          "$ref": "#/$defs/Regexp"
        },
        "glob": {
          "$ref": "#/$defs/GlobList"
        },
        "format": {
          "type": "string"
        },
        "time": {
          "type": "string"
        },
        "geometry": {
          "type": "string"
        },
        "colourFormats": {
          "items": {
            "type": "string"
          },
          "type": "array"
        },
        "htmlPolicy": {
          "type": "string"
        },
        "deprecated": {
          "$ref": "#/$defs/Deprecation"
        },
        "labels": {
          "items": {
            "type": "string"
          },
          "type": "array"
        },
        "hints": {
          "additionalProperties": {
            "items": {
              "type": "string"
            },
            "type": "array"
          },
          "type": "object"
        }
      },
      "additionalProperties": false,
      "type": "object"
    }
  }
}
