{
  "version": 1,
  "name": "test",
  "enums": [
    {
      "declare": "core/place-uris",
      "values": {
        "place://old": {
          "deprecated": {
            "label": "old-place-uri",
            "doc": "Use new place URIs"
          }
        },
        "place://new": {}
      }
    }
  ],
  "documents": [
    {
      "name": "Place",
      "declares": "core/place",
      "deprecated": {
        "label": "place-document",
        "doc": "Stop sending these plz"
      },
      "attributes": {
        "title": {
          "allowEmpty": true,
          "deprecated": {
            "label": "genii-loci",
            "doc": "What places need names anyway?"
          }
        }
      },
      "meta": [
        {
          "declares": {"type":"core/place"},
          "attributes": {
            "role": {"optional":true},
            "uri": {
              "optional": true,
              "enumReference": "core/place-uris"
            }
          },
          "data": {
            "position": {
              "format": "wkt",
              "geometry": "point",
              "optional": true
            },
            "position_3d": {
              "format": "wkt",
              "geometry": "point-z",
              "optional": true,
              "deprecated": {
                "label": "3d-points",
                "doc": "Too ambitious, don't want"
              }
            },
            "area": {
              "format": "wkt",
              "geometry": "polygon",
              "optional": true
            },
            "road": {
              "format": "wkt",
              "geometry": "linestring",
              "optional": true
            }
          }
        },
        {
          "match": {
            "type": {"const":"core/place"},
            "role": {"const":"absurd"}
          },
          "attributes": {
            "role": {
              "allowEmpty": true,
              "deprecated": {
                "label": "absurdity",
                "doc": "Why did we ever think this was a good idea?"
              }
            }
          }
        }
      ]
    }
  ]
}
